{
  "domainId": "cpu-memory",
  "version": "2.0.0",
  "name": "CPU memory hierarchy",
  "description": "Diagnostic worlds over cache behaviour. All evidence is produced by real set-associative cache / coherence / prefetch simulations across a 12-family causal catalogue.",
  "causes": [
    {
      "id": "conflict-miss",
      "label": "Cache set conflicts"
    },
    {
      "id": "associativity-cliff",
      "label": "Associativity cliff"
    },
    {
      "id": "capacity-miss",
      "label": "Working set exceeds cache"
    },
    {
      "id": "compulsory-miss-surge",
      "label": "Cold-data churn"
    },
    {
      "id": "spatial-locality-loss",
      "label": "Spatial locality loss"
    },
    {
      "id": "temporal-locality-loss",
      "label": "Reuse distance blow-up"
    },
    {
      "id": "false-sharing",
      "label": "False sharing between cores"
    },
    {
      "id": "true-sharing",
      "label": "True sharing on hot data"
    },
    {
      "id": "prefetch-storm",
      "label": "Useless prefetch traffic"
    },
    {
      "id": "prefetch-starved",
      "label": "Prefetcher starved"
    },
    {
      "id": "phase-change",
      "label": "Workload phase change"
    },
    {
      "id": "hierarchy-mismatch",
      "label": "Hierarchy mismatch"
    }
  ],
  "templates": [
    {
      "templateId": "regression-diagnosis",
      "modes": [
        "diagnostic"
      ],
      "difficultyBands": [
        1,
        2,
        3,
        4,
        5
      ],
      "conceptIds": [
        "cpu-cache-levels",
        "cpu-cache-miss",
        "cpu-write-policy",
        "cpu-coherency",
        "cpu-mesi",
        "cpu-prefetch",
        "cpu-memory-wall"
      ]
    }
  ]
}
